post,background
"Welcome to a new series of “My Journey at SalaryBox” where we talk with the team about how they got to SalaryBox, and what their stories have been.    Today we spoke with , a Software Engineer at our Gurgaon office, about what makes his work challenging and exciting.    📍What do you do at SalaryBox?  I’m a Software developer who joined the team in January 2022. I make sure that the web app and iOS interface used for millions of SalaryBox customers is up and running. We've redesigned the entire interface over the last couple of months, and also moved from Flutter to . This ensured that our customers have a great experience while using the product. I can see things improving as a result of my work, and that’s really satisfying.      📍How did you land in your current role?  I was a student of in Dehradun, and SalaryBox had come for campus placements. Funnily enough, I did not get selected after the final round. I was still very keen to join and reached out to the founders directly, to apply for an internship. The next thing I know that I was working with them a week later. Seeing my work, my internship was converted into a full-time role.   By joining SalaryBox I realized how much I value constant innovation and building new systems and tools. One of the coolest things about building new things is that it requires you to understand the vast scope of work, read and upskill yourself every day. It’s challenging, yet exciting work.    📍What’s a typical workday like for you?   Most of my day involves designing and building out the SalaryBox website app, so a lot of writing code and reading technical documentation ( and are lifesavers! ). I’d say I spend 15% of my time syncing with colleagues on updates for ongoing projects. I’m fortunate to have a variety of projects to work on — this helps me feel constantly challenged and motivated to work. Each morning we get together for an hour or so to discuss our weekly sprint goals. This allows us to make sure we’re on track as a team and to plan the rest of the week.  I feel like I have a great balance between collaborating and working independently.     📍What inspires you to come in every day?   It would be unfair not to mention all the amazing people I work with on a daily basis — my colleagues are a crucial part of the work I do. The support system here is incredible, and they guide me on how the current app is structured, and how new things can be added.  I've interacted with a lot of my friends, who are currently working at MNCs and other larger organizations. Sadly, they are yet to be allocated tasks and given core responsibilities. I, on the other hand, have been entrusted with multiple high-impact development items, and the ownership of my work really motivates me. Working at a startup has been a fantastic learning curve, and I've upskilled myself in multiple ways - that includes playing table tennis!","9,524 followers"
"April is the month for Health Information Professionals 🤗    Health Information Professionals are positioned at the intersection of healthcare, technology, and business, professionals in the health information space possess a uniquely comprehensive view of a resource critical to meaningful health innovation    In medical coding, clinical documentation integrity, data analytics, management, privacy, security, and beyond, we empower our partners in healthcare to provide high-quality, lifesaving care    Health Information Professionals (HIP) Week is dedicated to recognizing and honouring health information professionals in Nigeria    HIP Week 2022 is the perfect time to acknowledge individuals or teams who have responded with grace and achieved triumphs amidst the tumultuous changes and unprecedented challenges facing health information professionals during the pandemic    HIPWeek'22_NG aims at celebrating Health Information Professionals who ensure health stories remain accurate, accessible and protected through a social media engagement to tell the world of the beautiful stories of passionate, selfless and committed service delivery to patients/clients in a year of uncertainties    HIPWeek'22_NG is a week of reflection on our gains and achievements over the years and leverage on the emerging trends due to the COVID-19 virus in preparedness for future pandemics    HIPWeek'22_NG will recognise professionals for awards across four categories:    Spirit, recognising leadership or contribution to advancing a team during the fight against COVID and during the recovery phase    Impact, recognising significant and tangible impacts achieved during the last 20 months, specifically for patient/citizen or staff outcomes and experiences    1. Leadership, recognising where someone has led a team, department or organisation through digital transformation    2. Champion, recognising individuals who have gone above and beyond in their role    3. Dedication to the profession, recognising an individual's commitment and contribution to building the profession    4. Aspiring talent, recognising those at the start of their digital and data careers    Do you know anyone worthy of commendation to be considered for recognition 🏅⁉️🤔    The nomination will open soon, stay connected ‼️💫",Clinical Coder || Public Health Informatician || Health Information Management Officer
"Meet our Speaker - Laurene Redding ( Global Head, Strategic Pricing - BeiGene)    Laurene is passionate about healthcare and has vast expertise across all aspects of the health sector. She has a unique breadth of experience in the Canadian hospital system, at the Ministry of Health, with private insurance, and in the pharmaceutical industry. Laurene is a hands-on leader known to develop solutions to challenging problems and address unique opportunities.    joined , a global biopharmaceutical company, less than 2 years ago as the Canadian Head of Value, Access, and Policy, but soon afterward, evolved into the role of Global Head of Strategic Pricing on an interim basis. She has recently assumed the responsibility as the Global Head of Strategic Pricing for BeiGene, (ex-China).    Laurene received both her undergraduate degree in biology and pharmacology and a master’s degree in business administration from in Hamilton, Ontario. On a personal level, she is extensively involved in the board and community work. Laurene served for many years as Vice Chair on a private-school board and as Director-at-large, for the Canadian Gastrointestinal Society, the Milton Skating Club, and the Canadian Association for Population Therapeutics. Laurene is also deeply involved with the Canadian Red Cross, the Lifesaving Society, and the Heart and Stroke Foundation.      Date: August 16th, 2022  Time: 5:30-7:00 PM EST  Price: Members: $10; Non-Members: $15  Registration Link:    Sponsored by:",967 followers
"Blue Ocean Innovation 2022 🌊⚓️    The United Nations’ Sustainable Development Goal 14 is to “conserve and sustainably use the oceans, seas and marine resources.”    To achieve this, it is important to support the blue economy encouraging sustainable start-up companies, innovators and innovations that can scale to solve the ocean’s grand challenges.     1️⃣) Plant-based fish and seafood products🐟    Plant-based innovation is one of the biggest and most exciting growth areas in the food industry today, and while meat substitutes are the fastest growing sub-category in this market (an increase of 152 percent in 2019), fish and shellfish alternatives are now poised for dynamic growth.    Investment in alternative fish and seafood startups has been brisk, with new companies and products starting to expand the market.    2️⃣) Reversing the plastics crisis🧴    Plastics are useful. They're used to help make lifesaving medical supplies, lightweight, fuel-efficient car parts, and insulation for our homes. But nearly half of all plastic produced goes towards single-use items such as bags, straws, utensils and takeout containers.     There's a number of companies trying to develop cost-efficient and eco-friendly substitutes, from mushroom packaging to advanced fibers and plastic-free online shopping.     3️⃣) Ocean-based renewable energies⚡️    Rapid transformation of our energy systems is required if we are to achieve the goals of the Paris Agreement and limit the global average temperature rise. In addition to expanding land-based renewable energy, the ocean offers significant potential for supporting this transition.    However, new technologies must be implemented in a sustainable way in order to avoid unintended consequences that could undermine other aspects of ocean health.    To read more of our latest Future Thinking click on the link below 👇  ➡️","3,581 followers"
"Today, more than 20 months since India and South Africa first proposed a landmark intellectual property (IP) Waiver for #COVID19 medical tools at the World Trade Organization (WTO), governments have reached a decision. Dr. Christos Christou, International President of MSF shares his thoughts:    “We are disappointed with the inadequate outcome on waiving intellectual property for COVID-19 medical tools that resulted from more than 20 months of deliberations.    We acknowledge that a few changes were made to the agreement that mitigated some of the most worrisome elements of the earlier text presented in May 2022, but overall, we are disappointed that a true intellectual property waiver, proposed in October 2020 covering all COVID-19 medical tools and including all countries, could not be agreed, even during a pandemic that has claimed more than 15 million people’s lives.    This agreement fails overall to offer an effective and meaningful solution to help increase people’s access to needed medical tools during the pandemic, as it does not adequately waive intellectual property on all essential COVID-19 medical tools, and it does not apply to all countries. The measures outlined in the decision will not address pharmaceutical monopolies or ensure affordable access to lifesaving medical tools and will set a negative precedent for future global health crises and pandemics.    Throughout the pandemic, MSF has repeatedly pointed out the challenges and struggles faced by frontline healthcare workers in providing care for people facing COVID-19. Despite lofty political commitments and words of solidarity, it has been discouraging for us to see that wealthy countries failed to resolve the glaring inequities in access to lifesaving COVID-19 medical tools for people in low- and middle-income countries.    Without agreement on a true global solution to ongoing access challenges, MSF now urges governments to take immediate steps at the national level to make sure people have access to needed COVID-19 medical tools. Governments should consider using all available legal and policy options, including suspending intellectual property on COVID-19 medical tools, issuing compulsory licenses on key medical technologies to overcome patent barriers, and adopting new laws and policies to ensure the disclosure of essential technical information needed to support generic production and supply.    MSF also calls on governments to take concrete steps to rethink and reform the biomedical innovation system to ensure that lifesaving medical tools are developed, produced and supplied equitably where monopoly-based and market-driven principles are not a barrier to access. It is time to prioritize saving lives instead of protecting corporate and political interests.”","68,030 followers"
"On 19 July 2022, CITRIS Workforce Innovation Program interns, Azarely, Manjari, and I had an illuminating interview with Paula Padrino Vilela, an expert in the field of disaster management who worked for international organizations including the International Committee of the Red Cross (ICRC), NATO, and the UN Environment Program (UNEP) to help prevent and mitigate the effects of disasters on human life. She is currently the project coordinator of UNEP and is working to bring emerging technologies including fields like artificial intelligence, robotics, drones, and the Internet of Things (IOT) to the forefront of disaster response to more effectively prevent damage and save lives.     Paula related her insight into the rapidly changing world we live in. The effects of climate change only serve to accelerate the damage and death tolls incurred by disasters worldwide, but technology is also developing at an ever-quickening pace, allowing for new avenues to fight disasters every day. She sees artificial intelligence as the main technology that will allow for effective disaster prevention, while innovations in the fields of robotics, autonomous vehicles and IOT support the revolutionary power of AI. For example, robots and drones use AI for navigation and making autonomous decisions in the field, while the advent of the IoT lets widely distributed sensor suites feed data into a large data set to further improve upon and gain results from AI.      She also shared some of the challenges that least developed and developing countries face while working on disaster prevention and mitigation. These countries are often the most harshly impacted by climate change and its associated environmental effects, but have the least funds available for which to deal with them. Instead of pursuing the most cutting-edge technologies that first-world countries often do, they invest in simpler, proven, and durable means by which to detect and prevent disasters, which is something that must be kept in mind in order to make these lifesaving products accessible to all who require it.     Our interview with Paula helped us glean much insight into the field of disaster management worldwide, not just in the United States where we live. We hope to apply this knowledge in our work and beyond as the world grapples with a warming environment and an increasing frequency of disasters.",Systems Lead at Space Technologies and Rocketry
Gene Bio Medical is making waves in the health industry. Read the full article here.  #covid hashtag  hashtag  hashtag  hashtag  hashtag  hashtag   hashtag  hashtag    hashtag  hashtag  hashtag  hashtag  hashtag  hashtag  hashtag  hashtag  hashtag  hashtag  hashtag  hashtag  hashtag  hashtag  hashtag  hashtag   hashtag  hashtag  hashtag   hashtag  hashtag  hashtag  hashtag  hashtag  hashtag  hashtag  hashtag  hashtag  hashtag  hashtag  hashtag  hashtag  hashtag  hashtag  hashtag  hashtag  hashtag,387 followers
"This week, it was my pleasure  to welcome vaccine industry representatives and global immunization partners to UNICEF Supply Division’s Vaccine Industry Consultation.    Over 200 delegates participated in our largest consultation to date, from 27-29 September 2022. Together, we discussed challenges and solutions towards reaching immunization targets from a diverse range of industry representatives and partners.    More on my article below 📝:","Director at UNICEF Supply Division, Copenhagen"
"Wondering what the hype is coming out of #dreamforce2022 - grab a coffee and read my 5mins re-cap for Salesforce Marketing Cloud customers.    Team:  , , , , , , , , , , ,","☁️ Strategic Sales, Salesforce, Financial Services"
"Dr. Tech is your weekly digital health newsletter that covers digital health stories across the globe.    Find the latest information, news and insights on digital health in our newsletter series.    Follow Dr. Tech - Best Digital Health Newsletters                      ","Digital Health Specialist | Surgical Technologist | Research Developer | Lazord Fellowship Alumnus | Medical Innovator || Helping doctors, nurses & medical startups THRIVE"
"In my recent Forbes Business Council article, I discuss how to avoid the pitfalls of multitasking and a few actionable steps you can take to begin monotasking for better mental clarity and boosted productivity.",President at Marymount University
"Yesterday I gave a speech at The Australian Financial Review Government Services Summit.      If you are interested here are some extracts and the full copy is below in link 🙏     🔹Globalisation was not just about trading commodities on large ships. In the digital age, it's about sharing something far more powerful - ideas - on the internet. Whilst commodities are physical, ideas are intangible. So Trust has an even bigger role to play.     🔹When you place a digital lens over history, an unfortunate dovetail emerges. When the Cold War officially ended in the early 1990s, it was replaced with the beginning of the cyber war. Back then cyber was just starting to warm up - now it is dangerously simmering.      🔹Many people are uncomfortable that a Government would refer to people as ‘Customers’ as opposed to ‘Citizens’. The rationale is simple. Govt provide services to refugees, visa holders and tourists - who are not citizens.      Customer is an inclusive term, which means everybody is entitled to quality service delivery - citizens and refugees alike.      🔹We can use digital to empower the individual, build more Trust and therefore strengthen our precious democracy.     There is no other way forward. A trustless world, is a world of ever diminishing tribes.","Minister for Customer Service and Digital Government, Minister for Small Business, Minister for Fair Trading at NSW Government & Member for Ryde"
The 2022 International AIDS Conference is a prime opportunity for leaders and innovators to re-engage and follow the science in order to make the groundbreaking and necessary strides to achieve an AIDS-free generation. ,"President & CEO, Elizabeth Glaser Pediatric AIDS Foundation"
"There are writing campaigns to congress currently underway from #ClinicalGenetic and #Genomic society members trying to block the passage of the #VALIDact that would give the #FDA oversight of clinical genetic and genomic tests, as well as other Laboratory Developed Tests (LDTs). However, we at the support the VALID Act. To find out why we support it, please read our letter to congress, copied in the article linked below.","2,368 followers"
"Is the advent of UPI going to eventually make cash and card transactions a thing of the past?     In recent years, a large portion of the Indian public has switched to transacting through UPI, and this is because:    1. It’s fast, hassle-free and a cost-effective way to transfer your money.    2. It requires nothing more that a two-factor authentication process.    3. UPI apps have made it extremely convenient for users to link their bank accounts to the app online; and    4. It allows for the settlement of funds in real-time.    To know all about what this means for businesses and the economy in India, read the Newsletter!    Follow 🔥🔥🔥","11,488 followers"
#IVDR #EU #India #clinicaltrials    Will the IVDR delay patient access to innovative life-saving diagnostic therapies?    What impact will this have on clinical trials?,Chief Commercial Officer - MedTech/Digital Health/Diagnostics
#thedogtwins #dogtraining #k9unit #dogsarethebest,Senior Customer Care Representative with FoodScience LLC.Helping People and their Pets Live Healthier Lives. CritterCareVT.com
"Shawn Cain of PCI Pharma Services speaks to Contract Pharma Magazine about the pharma and biopharma trends driving opportunities & outsourcing in today’s market.      Read more about the growing demand for lyophilization technology in support of parenteral products, and the boom of biologics versus small molecule pharmaceuticals is impacting the traditional approach for sterile fill-finish services.","17,406 followers"
"Urgent change is needed to standardise knowledge and treatment creating greater access to the best radiation therapy has to offer throughout the NHS in England. Innovation is crucial if we are to meet the ambitions of the 10-year Cancer Plan, but underpinning this must be a plan to standardise and ensure equality of access to available innovations such as stereotactic radiosurgery (SRS), a highly targeted treatment which is improving outcomes for people with brain cancers and metastases. Read my article to find out more. ",Country Manager UK&I at Elekta
Check out our latest article on how Banyan is celebrating their staff during Nurse Appreciation Week! #nursesweek,"2,495 followers"
"Tableau peut vous aider à sauver des vies. Découvrez comment le don de son rein, il y a neuf ans, a inspiré le chef de produit de Tableau, Mark Shulman, à construire cette Viz qui aide à éduquer et à engager les donneurs potentiels de rein.",Enthusiastic Digital Transformation Enabler in Public Sector & Healthcare at Salesforce
"Here is the seventh edition of our #linkedinnewsletter, FinStep Asia's Web 3.0 TokenBytes Newsletter for all things in Web 3.0, FinTech and DeFi in Asia.  In this edition we look at  a) Metaverse and market developments from HSBC, Standard Chartered, Lenovo  b) Major developments in Fintech & DeFi from Goldman, OneDegree, Samsung, Gemini, FIS  c) Regulatory developments in , , , and from Malaysia, China and Singapore,  d) NFT marketplaces to explore and  e) Must read Web 3.0 Industry reports from MEDICI, PwC, Checkoutcom, BIS, FT Partners, Wealth Mosaic, Thomson Reuters and India InsurTech Association + BCG.    Hit Like, Subscribe and Share :)          .0",FinTech Ballerina | Digital Assets | FinTech | Blockchain | Web 3.0 | Regulatory
"This week is Maternal Mental Health Awareness Week (2-8th May). As part of this, I've written an article about ""Maternal Mental Health in the Workplace"", using my lived experience of postnatal depression as an example.    I would love it if you could read the article, and share it with anyone who might benefit from my reflections.    Most advice that I've found on postnatal depression tends to focus on the person who is suffering, their family or friends, or healthcare professionals. I hope that this article will extend this, and help to bring the discussion into the workplace.    I have some suggestions of how employers and colleagues might help women who are experiencing postnatal depression and other perinatal mental problems, but I don't claim to have the answers. Hopefully this article will spark reflection and conversation within the particular context of your own organisation.    The article includes links to further information if you want to find out more about maternal mental health (and paternal mental health: check out , founded by ).    Definitely take a look at the website of the fantastic Perinatal Mental Health Partnership, who run the campaign ( - founded by ). And take a look at the .    If you have any feedback, insights, or inspirational stories that you'd like to share, please feel free to include them in the comments.",UX Designer @ Qrious | Co-founder of #WomenInTechNE | Code First Girls Ambassador | Mental Health First Aider
"HERA - THE WORLD'S ONLY BACKPACKED DRONE FROM VIETNAM    All backpackable drones ever made have a lift capacity from 1 to 5 pounds max. To serve the majority of use cases, the lift has to be around 30 pounds. Having both backpack portability and a sixfold increase in lift capacity turned out to be extremely challenging. Nobody from giant drone makers to new startups has been able to find an answer.     Realtime Robotics (RtR) is the only drone manufacturer that has successfully tackled this puzzle. Our Hera drone is small enough to fit in a backpack, yet powerful enough to lift 33-lb payloads, mount four gimbaled payloads simultaneously, deliver 360-degree FOV for every payload, and ensure data transparency and security. Hera simply sets the world records in almost all critical features, an unprecedented achievement in drone history.     Follow us on              ",Generalist | Marketer | Planner | Blogger | Activist
"Last week, I had the pleasure of speaking at Open Data Science Conference (ODSC) about FedEx Dataworks and how we are leveraging data from the millions of packages that pass through the FedEx network daily to help make supply chains smarter for everyone. It was a great opportunity and conversation, and for those who were unable to join, I’ve highlighted the key takeaways about how we are transforming the industry in the article below.","Senior Vice President, FedEx Dataworks"
"I share here some of the strategies I hope can help you in your company's journey to continued success. At V-Soft Consulting Group, Inc. we moved from the outbreak and chaos to 25%+ growth in 2021, and our goal is to grow another 30%+ in 2022.",Tech Entrepreneur 💡 Restaurateur 🍛 Vintner 🍷
#leap22 #leap2022,Information Technology Consultant at Nokia
"Successful customer relations go beyond contracts and figures. It’s a human-to-human connection that we nurture by carefully listening to our customers, understanding their needs, and helping them overcome challenges and win advantages. Here we share some of our insights how engineering services can help you bring technologies into life while gaining more benefits for your projects.   ",Senior executive manager Engineering Services | Putting Customer & Business excellence first | Devoted to the passion for Engineering
